{
  "defaultExtentX": 220,
  "defaultExtentZ": 160,
  "castleExtentX": 1000,
  "castleExtentZ": 1000,
  "postExtentX": 1100,
  "postExtentZ": 360,
  "templeExtentX": 950,
  "templeExtentZ": 560,
  "marketExtentX": 920,
  "marketExtentZ": 760,
  "industrialExtentX": 1040,
  "industrialExtentZ": 850,
  "plannedExtentX": 960,
  "plannedExtentZ": 800,
  "valleyExtentX": 520,
  "valleyExtentZ": 135,
  "dispersedExtentX": 580,
  "dispersedExtentZ": 380,
  "clusterExtentX": 230,
  "clusterExtentZ": 170,
  "countrysideFrontage": 24,
  "siteSampleDirections": 16,
  "siteSampleStep": 100,
  "siteSampleSteps": 12,
  "siteReliefRadius": 600,
  "siteWaterHeight": 0.5,
  "portMaximumHeight": 65,
  "portMinimumShoreDistance": 90,
  "portMaximumShoreDistance": 650,
  "templeRelief": 35,
  "templeChoiceThreshold": 50,
  "industrialMaximumRelief": 25,
  "industrialChoiceThreshold": 8,
  "plannedChoiceThreshold": 22,
  "castleChoiceThreshold": 35,
  "postChoiceThreshold": 72,
  "marketChoiceThreshold": 87,
  "townScale": 0.52,
  "portExtentX": 1100,
  "portShoreSetback": 45,
  "portMinimumDepth": 160,
  "portMaximumDepth": 480,
  "valleyRelief": 28,
  "dispersedChoiceDivisor": 3,
  "oldCoreOffset": 0.25,
  "stationOffsetX": 0.48,
  "stationOffsetZ": 0.26,
  "coverageMargin": 48,
  "fringeWidth": 38,
  "coreMargin": 22,
  "fringeOccupancy": 0.82,
  "cityFringeDecayDistance": 530,
  "townFringeDecayDistance": 340,
  "ruralHomeRadius": 42,
  "dispersedHomeSpacingX": 230,
  "dispersedHomeSpacingZ": 190,
  "dispersedHomeHalfX": 35,
  "dispersedHomeHalfZ": 38,
  "valleyHomeHalfWidth": 55,
  "clusterHousingHalfX": 240,
  "clusterHousingHalfZ": 175,
  "cityStationRadius": 240,
  "townStationRadius": 150,
  "stationStreetRadius": 55,
  "commercialAxisWidth": 65,
  "commercialAxisLengthRatio": 0.9,
  "marketCrossWidth": 65,
  "edgeDensityReduction": 0.16,
  "edgeDensityStart": 0.65,
  "edgeDensityRange": 0.35,
  "plannedHousingStartX": 0.25,
  "plannedHousingStartZ": 0.25,
  "historicGridLinearWeight": 0.84,
  "historicGridCubicWeight": 0.16,
  "industrialStreetOmissionDepth": 0.75,
  "contourSampleRadius": 160,
  "castleCivicX": 0.62,
  "castleCivicZ": 0.17,
  "castleCivicWidth": 0.4,
  "castleCivicDepth": 0.35,
  "templeCivicX": 0.3,
  "templeCivicZ": 0.34,
  "templeCivicWidth": 0.6,
  "plannedCivicX": 0.52,
  "plannedCivicZ": 0.2,
  "plannedCivicWidth": 0.34,
  "plannedCivicDepth": 0.34,
  "industrialZoneX": -0.05,
  "industrialZoneZ": -0.7,
  "industrialZoneWidth": 0.4,
  "industrialZoneDepth": 1.4,
  "portIndustryX": 0.9,
  "portIndustryZ": 0.53,
  "portIndustryWidth": 1.8,
  "portIndustryDepth": 0.47,
  "fringeFrontage": 24,
  "civicFrontage": 36,
  "civicOccupancy": 1,
  "industryFrontage": 40,
  "industryOccupancy": 0.92,
  "dispersedRoadHomeFrontage": 28,
  "dispersedRoadHomeOccupancy": 0.92,
  "dispersedHomeFrontage": 42,
  "dispersedHomeOccupancy": 0.64,
  "villageHomeFrontage": 23,
  "villageHomeOccupancy": 0.84,
  "stationFrontage": 15,
  "stationOccupancy": 0.98,
  "stationStreetFrontage": 14,
  "stationStreetOccupancy": 0.96,
  "merchantStreetFrontage": 14,
  "merchantStreetOccupancy": 0.98,
  "plannedHomeFrontage": 23,
  "plannedHomeOccupancy": 0.94,
  "historicHomeFrontage": 17,
  "historicHomeOccupancy": 0.96,
  "historicSpacingCross": 85,
  "historicSpacingAlong": 108,
  "linearTownSpacingCross": 75,
  "linearTownSpacingAlong": 120,
  "modernSpacingCross": 135,
  "modernSpacingAlong": 150,
  "dispersedSpacingCross": 190,
  "dispersedSpacingAlong": 230,
  "villageSpacingCross": 170,
  "villageSpacingAlong": 145
}
